{
  "schema_version": 1,
  "protocol_version": "latency-v1",
  "extensions": {},
  "artifact_id": "00000000-0000-4000-8000-000000000009",
  "uri": "fixture://example/PROF",
  "sha256": "aaaaaaaaaaaaaaaaaaaaaaaaaaaaaaaaaaaaaaaaaaaaaaaaaaaaaaaaaaaaaaaa",
  "bytes": 1024,
  "kind": "RAW_PROF",
  "created_at": "2026-10-03T15:30:00Z",
  "redacted": true,
  "media_type": "application/x-tar"
}
